{
  "season_id": "2025-26",
  "gameweek": 3,
  "deadline": "2024-08-30T11:00:00Z",
  "observed_at": "2026-07-21T12:00:00Z",
  "available_at": "2026-07-21T12:00:00Z",
  "provenance": {
    "source_ids": [
      "fpl-official-endpoints"
    ],
    "transformation_version": "0.1.0",
    "ruleset_id": "2026-27-v0.1"
  }
}
